doc_id,title,term,url,text
1,"What is Zero UI?
Are the interfaces running out? Understand the term “Zero UI” and what it means to us designers.",zero ui,https://brasil.uxdesign.cc/o-que-%C3%A9-zero-ui-d416d8aac8e4,"A quick Google search shows that for some time there has been talk about Zero UI (zero user interfaces) and what will become of the designer profession when screens disappear.
But Zero UI does not mean the complete extinction of interfaces; it just means the end of interfaces as we know them today.
Consider the following for a moment: Today interfaces only exist because computers are “dumb”.
So we humans, very intelligent beings, need to go there and give instructions to the computer. In the past the only way to do this was by memorizing commands and typing our intentions into an interface like this one:

Over time, we designed more user-friendly visual interfaces that helped us accomplish the same tasks much more simply.

And more recently, even simpler:

In this process of technology evolution, the visual interfaces we know today take on a secondary, background role, giving us space to engage with the things that are really important to us - other humans, the physical spaces we inhabit, nature, the environment. society.
Zero UI is precisely the name of the process of disappearing visual interfaces, to make room for other types of interfaces . Voice, movement, eyetracking, brainwaves, among others. That is, the term “zero UI” itself is incorrect because the interface does not cease to exist. But for now, as a way of educating our industry and provoking designers about this impending technological change, it works.

And what does this mean for us designers?
That the experiments we are designing (and the interfaces that control them) are becoming much more complex - as many other aspects of human behavior must be taken into account.

Design principles remain the same: design experiences that are easy, intuitive, enjoyable, and subtle. Only what changes is the material we use to make these experiences happen.
What to expect as a designer:
Much less software that draws pixels (Photoshop, Sketch, Illustrator), and much more software that draws interaction streams.
Much, but much more testing. Internal testing while something is being designed (after all, not just “looking at the layout” to see if it works), quality control testing , and user testing .
The emergence of other types of specialization in our industry, such as verbal designer, conversational designer, gesture designer.
Our role as UX Designers remains exactly the same: identifying our audience's needs and wants, thinking about products, services and features that deliver those demands, strategically thinking and prototyping these interfaces, and then testing with users to enhance the experience with each new cycle. .
Ready to head for it?"
2,"Bots, Chat, Voice, Zero UI, and the future of Mobile Apps",zero ui,https://chatbotsmagazine.com/the-future-of-ui-bots-conversation-voice-zero-ui-and-the-end-of-the-mobile-apps-defa5dcc09f5,"“Alexa”- “Play Blake Shelton-Hillbilly bone.”
“Siri”– “Text Alex that I am running late for the meeting.”
As I do this without opening an app on my iPhone with its crowded screen and some 50+ apps, I am hit hard with the thought, the idea of a mobile app as an “independent interaction destination” is becoming irrelevant. The action has shifted to Voice, Natural Language, Notifications, API, and the Conversation; and this has a huge impact on existing mobile app-dependent businesses and how we build and design products in the future.
Before you shake your head in disbelief, let’s put things in perspective:
1. The mobile app discovery and its feature discovery layer is broken. There are more than three million+ apps combined in all app stores, and the last thing we need is more apps or features.
2. Mobile users have limited attention spans, often jumping from one app to another. An average smartphone user has 42 apps on his device but spends 90% of his time on only 9 or 10 of them.
3. Companies spend billions of dollars every year to drive installs and user engagement, but 25% of apps are only used once and 75% of users leave within the first three months.
4. The growth of mobile and its app-centric world has been the opposite of the web, and there is no analog of PageRank for mobile apps.
5. The interaction at the UI layer of mobile is very crowded. A mobile screen with crowded app icons as a dominant design pattern feels old and inefficient now.
6. Messaging is the most widely used application on the mobile platform, with chat-based apps like WhatsApp, WeChat, and Facebook Messenger owning the communication layer of the world.
7. Application and device interaction is beginning to shift due to developments in Voice Control and Intelligent Assistants (IA). Already, more than 15% search queries are made on Baidu using Voice Input.
These points have a major bearing on mobile products and app-dependent businesses. Recent advancements in voice technology and AI suggest that we are undergoing a paradigm shift in how we interact with technology. Ever tried Apple’s Siri, Google’s Now, Microsoft’s Cortana, Amazon Echo, Google Nest, or Facebook’s M?
All this progress leads to a whole new set of open questions — is Conversation the next frontier? What role does design play in creating one of these experiences? And most importantly, what happens when our devices finally begin to understand us better than we understand ourselves?
Advances in AI and technology are causing a change in our traditional understanding of UI and human-computer interaction.
So let’s dive deep.
Historical Evolution — The Story of New Platforms
Technology Wave leverages platforms to build scale. New platforms enable new applications, which in turn make the new platforms more valuable, creating a positive feedback loop. Technology progress in the last 20 years has thrown up three key platforms — mainframe/PC, the Web, and mobile. Each platform requires recreation of the application layer, built and customized to grow and scale the new platform. Refer to the picture below.

Because of these technology product cycles, there are mutually reinforcing interactions between platforms and applications. In the last seven to eight years, we have shifted from an “era of the web with browser-based applications” to an “era of smartphones with native apps.” With the growth of mobile -as- a- platform, the application layer also underwent a substantial change.
With the change in platform, this shift is set to happen again. What we are witnessing now is the “hyper-growth phase” of the mobile platform and, by 2020, almost 80% of people in the world will have a smartphone.
If 2020 is “peak mobile,” then we are already in the gestation phase of a new platform, which will require recreating new application layers. This means that applications built for mobile as the primary platform are slowly beginning to lose relevance.
Our experience of the mobile screen as a bank of app icons is dying and we are moving toward a UI-less computer interaction environment. This change in paradigm has a massive impact on how we need to design and build applications.
Remember, thus far, all human progress has been about how humans interact with machines.
The Paradigm Shift in the Transfer of Knowledge
How would you define the UI of Amazon Echo, Nest thermostat, or Siri?
Is it voice, a shrug, a grunt, or a caress?
Before you answer that, let’s refer to an important thread in technology history — The Transfer of Knowledge.
The transfer of knowledge, thus far, has evolved in three paradigms — human to human (past), human to machine (present), and machine to machine (future). For the first time in our history, the new transfer of knowledge will not involve humans.
Advancements in the Internet of Things (IoT), Artificial Intelligence (AI), and robotics are ensuring that the new transfer of knowledge and skills won’t be to humans at all. It will be directly machine to machine (M2M).
Objects such as smartphones, connected cars, iBeacons, wearables, and cameras will begin to communicate in ways that no entrepreneur has yet to imagine. Google Mind, Boston Dynamics-Atlas, virtual reality, and drones are just a glimpse of things to come.
Our experience of technology is becoming so immersive that the idea of an app as a destination is becoming far less important, and very soon the primary interface for interacting with apps might not be the app itself.
We’re entering the age of apps as service layers, where apps are intelligent, purpose-built, and informed by contextual signals like location, hardware sensors, previous usage, and predictive computation. They respond to us when we need them to, and represent a new way of interacting with our devices.
Hence, the Application-User Interface is undergoing a massive paradigm shift, and these are the key trends driving it:
1) Apps are Becoming APIs and Bots are Taking Over
Looking back to the Web 2.0 era of the mid-2000s, we’ve witnessed a huge change to the Internet. It went from static pages and moved towards applications. Sites like Google Maps or Flickr opened up their APIs, allowing anyone to build websites pulling in their data. With this ability to create new things on top of this data, websites were transformed from static pages into dynamic services.
Now, we are witnessing the same ‘shift’ in Mobile. With an increasing number of mobile apps and decreasing size of the mobile screens, we’re reaching a peak in the mobile “OS & Apps” paradigm. Downloading, setting up, managing, and switching between so many apps on our mobile device is merely becoming inefficient.
Thus, transaction-based apps such as those to book cabs, search, and shop or order food are predominantly turning into APIs within the messaging apps. It does not matter anymore which app owns the user. Eventually, the operating system or the platform everyone has built their application on ends up owning them all. However, there are some exceptions to this, particularly in China, where the OS platform itself is still fragmented, and the applications reside in the root of the mobile OS on that platform.
We are also witnessing something similar to a trend in the ’90s, when browsers replaced the desktop OS as the new platform, and websites replaced client applications. A similar transformation is happening today. Messaging bots are beginning to replace mobile apps.
Bots are to modern messaging apps what APIs were to Web 2.0: a way to build on top of other services and a new way of interacting with underlying (existing) services, significantly changing human-and-computer interaction.
Therefore, we are witnessing the start of an era, where messaging is the new OS, Bots are the new apps, and the “bot store” is the new app store.
We are just at the beginning of the bots era and there are many more developments to come. These developments will open up new and giant opportunities for consumers, developers, and businesses.
Some leading players in this space are Messenger, WeChat, Line, Kik, Slack, and Telegram.
2) Notification is the Interface and Emergence of Super Apps-as-Platforms
The days of sending lots of notifications to bring people back to an app are going away. The focus is on designing notifications that people can engage with then and there without opening the app. This new paradigm matches much more closely with how real life works. We don’t live our lives in silos, like the app silos that exist today. People are beginning to forget about apps and thinking in terms of businesses, products, solutions, and services.
There is a definite trend towards notifications as the new interface. Very soon, we may not need to open an app to interact with it. It will still live on the device, but its interface will reside on the top layer of our phone, the notification layer. With the container for content soon becoming invisible, learning to engage users via notifications is the key.
Paul Adams, former Googler wrote this:
“In a world where notifications are full experiences in and of themselves, the screen of app icons makes less and less sense. Apps as destinations make less and less sense. Why open the Facebook app when you can get the content as a notification and take action — like something, comment on something — right there at the notification or OS level. I believe screens of apps won’t exist in a few years, other than buried deep in the device UI as a secondary navigation.”
Action now resides in the notification. Google Streaming and Apple Extensions are a step in that direction.
This trend is very much visible in what’s already happening in China with Baidu and WeChat, where smaller apps are getting bundled within bigger apps, only surfacing when some interaction in the UI invokes the smaller app. For example, in Baidu Maps, you can find a hotel, check room availability, make a booking, and make payments, all inside the app.

Baidu Maps allowing users to search, book and confirm a movie
Looking at the Chinese internet market is always a great way to challenge one’s belief in what’s inevitable. In this case, Baidu Maps, Alipay, and WeChat, amongst others, are thriving on exactly this approach, that is, bundling multiple services into one Super-App.

Walled Gardens, Portals, Platforms- Chinese App UI’s
In the western world, Facebook is also looking to bundle its Messenger back with a layer of accessories, highlighting how short the cycle of unbundling can be in a mobile-first world. I think Facebook is very likely to make some major announcements at the forthcoming F8 in April 2016 around Bots and Messenger as a platform.
3) The Shift to Context, Conversation, and Human UI
Since messaging apps are used more than any other application on the mobile platform, what if instead of installing an app, we allow a service to chat with us via a message?
One trend that is making good use of advancement in natural language processing is the rise of Chatbots and Conversational UI’s, that is, using automated software inside WhatsApp/Messenger/WeChat or other messaging apps.
The cause of this shift is simple: human nature. The conversational interface allows users to ask questions, receive answers, and even accomplish complex tasks in both the digital and physical world through natural dialogue.
Humans are innately tuned to converse with others. It’s how we share knowledge, emotions, and organize ourselves. Language has been part of our makeup for hundreds of thousands of years. So, of course, we message all day long in bursts and binges, with family, friends, and colleagues. Messaging has become a platform through which our daily life is conducted.
My experience, in China and other South East Asian countries, of using Weixin (WeChat)and Alipay for booking cabs, movie tickets, checking flights, making payments, video calls, and more has only reinforced my conviction — that a chat and voice-based messaging, payment, and commerce platform is the future of the “attention economy.”
These apps don’t use a traditional UI as the means of interaction. Instead, the entire app design revolves around a single messaging screen; hence, they are called “Invisible” or “Conversational” apps. While these apps support a slew of different functions, from checking our bank accounts, scheduling a meeting, making a reservation at a restaurant, to being our travel assistant, they all have one thing in common: messaging is at the heart of the interaction.
Led by Facebook Messenger in the West, and WeChat in the East, messaging apps are quickly transforming themselves into all-encompassing platforms, thereby allowing users to buy products and services, send payments, communicate with businesses, and engage in commerce, leading to a convergence of context and transactions within messaging platforms.
Two good examples of this approach are Baidu Maps and WeChat in China.
Using Baidu Maps, you can not only find a restaurant but also book a table or order home-delivery. You can find where a film is showing and choose a seat. You can order a cab, with cabs from all the services in your city shown together on the map. You can book a hotel room or an on-demand cleaner. Most of these services are provided through embedded third-parties service providers’ applications — Baidu is already doing deals with other Chinese Internet companies to provide this.
WeChat (which now has 840M users) is doing much the same, but, of course, starting from a chat experience rather than a maps experience. WeChat has amassed a massive user-base, become a platform (where the underlying OS doesn’t have power because of multiple operating systems), and emerged as a ‘Super-App’ — the mother of all the apps.

Booking a doctor appointment via WeChat Wallet- Image credit a16z.com

WeChat Virtual Assistants- KPCB
‘An App within an App’ is very different from ‘Chat based Interface.’ You’d need to use WeChat in China to understand the location ‘context’, and the entire WeChat ecosystem — Official Accounts, Payments, Location,QR codes, O2O and API’/Application Layer, tech architecture, etc. It is akin to a Portal, Platform, and Mobile OS combined, and very different from anything in the western world.
Another important aspect to note is the increasing role of pre-existing context. Extending the Baidu Maps example, bookings are an organic extension of the context the user already is in. We’ll already be searching for restaurants on the map depending on our location, but now “make a booking” and “pay” will appear.
In the Western world, a significant step in that direction is the recent partnership between Facebook and Uber; now we can order an Uber-Cab within the Messenger app. Facebook is also releasing M, a personal “Intelligent- Assistant,” integrated within Messenger to help us do just about anything.
We are seeing this trend in conversational interfaces where companies like Operator and Magic are leading the way, designing rich experiences for their clients to interact with directly.

Operator.com screenshots
In conversational interfaces, the user experience is primarily a sequence of messages that flow back and forth and involve little layout and design, thus rendering the old paradigms obsolete.

New start-ups developing invisible and conversational apps understand that the UI is not the product itself, but only a scaffolding allowing us to access the product.
And that brings me to our next key trend.
4) Voice Interface, Zero UI and the End of the Screen-Based Interface
Extending the Echo and Siri example — are we in an era of Zero UI?
“Not entirely, but we’re getting close.”
Zero UI is the concept of seamless interaction with technology by removing the barrier between user and device. Typically we interact with a device directly through a touchscreen or indirectly with remote control. However, Zero UI is the push to become even more integrated with technology, such as touch-less tech in the case of Amazon Echo.
Natural language processing, the field of computing and AI concerned with making computers understand and speak the natural languages of humans, has come a long way in recent years. Once the stuff of science fiction, advances in the field of machine learning and voice control have made voice interfaces far more practical, and this is making it easier to communicate with the devices around us.
While a world entirely devoid of physical interfaces may never be a reality, a world tied less to our devices is already happening. At the helm of this transition are gesture-based user interfaces such as Project Soli.

The gaming world was the first to adopt gesture controls as a way of providing a more natural user experience. Think the Wii, PlayStation Move, and Microsoft Kinect. Our gaming consoles are less tied to button commands and instead integrate more properties of physical space and motion into our experience.
All of this is causing a shift in “design-think.” Instead of just designing for two-dimensions — that is, what a user is trying to do right now in a linear, predictable workflow — now the designers need to think about what a user is trying to do in any possible workflow.
Andy Goodman, group director of Fjord, coined the term “Zero UI,” and defined it as “The new paradigm of design when our interfaces are no longer constrained by screens, and instead turn to haptic, automated, and ambient interfaces.“
Zero UI is not a new idea. If you’ve ever used an Amazon Echo, changed a channel by waving at a Microsoft Kinect, or set-up a Nest thermostat, you’ve already used a device that could be considered part of Zero UI thinking.
It’s all about interfacing with the devices around us in more natural ways: voice control and artificial intelligence, haptics, and computer vision.
Maybe next time you’ll say,
“Alexa — book me a flight to Singapore and charge to Visa card!
In Conclusion: Re-Architecture and Re-Platforming for the Next Decade
Web and mobile platforms are going through a massive re-architecture and re-platforming.
2016 is definitely the year of everything conversational, and messaging is eating the world. Every community, marketplace, on-demand service, a dating app, social game, or e-commerce product has or will soon have chat as part of the experience to drive retention, engagement, and transaction volume.
The current “pull-based” (we visit websites or download mobile applications) world is giving way to “push-based” (everything will come to us) world. With this “Big Reverse,” applications are disappearing into the background much like our electricity or water supply.
Powerful speech technology from leading Internet companies is making it much easier to ignore the touchscreens on devices for something much more efficient and intuitive: our voice. The advancements in voice interface will also lead to the start of voice payments and voice commerce.
Although, we are witnessing is the rise of the conversational and voice interface, the next wave is likely to revolve around Artificial Intelligence (AI). Intelligent Assistant applications like Echo, Google Now, Cortana, Siri, and Facebook M are an early example of how text/voice-based, conversational interfaces, will shape the world around us.
The entire history of computing is nothing but the history of progress in our ability to communicate with machines. With AI-powered interfaces, what happens once we achieve Zero UI? What happens when our devices finally understand us better than we understand ourselves? What happens when the machines reach or surpass the “human level” of intelligence and computers get embedded in us?
Do we become the next UI? — — Singularity, Anyone!!!"
