doc_id,title,term,url,text
51,Voicebot development insights from the winners of the Actions on Google Developer Challenge,voicebot,https://medium.com/@memerunner/voicebot-development-insights-from-the-winners-of-the-actions-on-google-developer-challenge-e3fade1d8ac3,"This winter it was as if CES was trying to prove to the holiday season that it could create the most buzz around voice assistants. So at least heading into 2018, it looks to be an exciting year for the #VoiceFirst movement.
And Google recently announced winners of the Actions on Google Developer Challenge, with awards and cash going to what they judged were the best voicebots on the Google Assistant platform in 2017. It’s about time for someone to launch an awards show called the Bottys.
At any rate, it’s worth looking into the winners and seeing what they’re doing. While we don’t have hard data to indicate if what they’re doing is working, at least they’re getting Google’s nod of approval.
So I’m going to analyze the first, second and third place winners to see what we can learn from them.
And without further ado, here they are.
100 Years Ago: An app that travels back in time 100 years and lets you listen to an interactive radio show, including breaking news and the latest hit songs circa 1917
Credit Card Helper: Helps users find the best credit cards quickly and avoid traps.
My Adventure Book: Storytelling game that lets users navigate their own adventure.
There are 4 areas we’ll assess to better understand how these apps work.
Invocation
User interface
Landing page content
Developer comments
Invocation
The invocation is what you say to Google to get to the app. It’s the name. Now, voice apps aren’t that easy to discover. It’s not like people surf Alexa or Home like they might the web. Currently, users take a linear path through the medium, and typically have a clear idea of what they want to do or find out, if not specifically where they want to go. Categorically, audio information is consumed more linearly than graphic information.
The invocation is no small part of an apps success. The easier to say and remember, the more likely people will be to actually use it.
Here are the invocations for the three winners.
100 Years Ago
“Talk to 100 Years Ago”
Credit Card Helper
“Ask credit card helper what the best credit card is”
“Ask credit card helper what the risks of credit cards are”
“Ask credit card helper what to do if my card is stolen”
“Ask credit card helper what type of credit card i should get”
“Talk to credit card helper”
My Adventure Book
“Talk to My Adventure Book”
Credit card helper is using a range of invocations to touch on different user interests. Consider the difference between “what the best credit card is” and “what to do if my card is stolen”. The first one could drive users directly into a new customer funnel, and the second helping an existing customer’s make account changes. Both great features to offer, addressing people at different stages of the customer experience path.
So developers and marketers will want to use terms that are easily remembered, easy to say, distinct from other voice apps, and offer directions to specific sections of the app, where possible.
User Interface
Once the user passes through to the app, it’s imperative to create a positive experience as quickly as possible. Like websites and mobile apps before them, voicebots will likely succeed or fail based on the first 30 seconds of the experience.
And here’s how each app greets you after a successful invocation. These screens were grabbed while interfacing with Google Assistant on the phone, as it displays the script the Voicebot speaks for easy reference here.
100 Years Ago

Credit Card Helper

My Adventure Book

You can see the relative simplicity of these apps. And of course that’s to be expected from first forays into new territory. However, even early web pages often provided link after link. This is an early indicator of what will likely be a challenge for the voice web for a while to come: The small amount of content that users can comfortably navigate and consume.
One UX issue I noticed is, when going back through an app repeatedly, it’s great when you can skip through large sections of the script that you’ve already been through. Especially at the intro. Credit Card Helper did this very well, and it removed a sense of tedium from the process. You just have to say “Hey Google, skip” and you’re on to the next section.
Here’s the main navigation structure for each app.
100 Years Ago
Hear the news
Listen to music
Speak to special guest
Credit Card Helper
Help finding a card
Browse by category
About our research
My Adventure Book
Single launching point with multiple paths to follow
It makes sense the simplicity of the navigation reflects the simplicity of the overall app experience, although Credit Card Helper has extensive content on each of the credit cards in its database.
A frequent discussion point in voicebot design is the optimal depth for a nav. I’ve heard more than one person say 3 is ideal. I think that might be where we are now, although I’m sure that will expand as people become more familiar with the technology.
Additionally, the AI technology behind the speech interface is also going to improve dramatically, increasing the accuracy and quality of experience.
App directory
Due to the invocation process for voicebots, one of the major marketing challenges is getting users to remember the exact invocation name. You might hear it on the radio, or see it in an ad, but when you go to visit the voicebot, via voice, you have to remember what’s likely to be a 3 word name. Not a simple task, especially when you consider marketers spend bazillions just to get consumers to remember their simple brand name.
To help with finding apps, Google has created an app directory where each voicebot has its own page. This is an opportunity to prep the visitor for their upcoming user experience.
Here are the Google Directory pages for each app.
100 Years Ago

Credit Card Helper

My Adventure Book

Firstly, you can see how the many invocation phrases on the Credit Card Helper stands out, offering the user additional ways to invoke and discover the app.
The description area offers brands a place to briefly (hopefully) summarize why users should visit the app. You can bet there will be a lot of discussions within marketing departments over what goes on this page. Suffice it to say that well written copy with a clear sense of the app’s mission is going to be critical.
I’d also guess that Google will expand on the media available for presentation on this page.
Developer Comments
Given the recency of this industry, there’s not much in the way of best practices or industry standards. Brands are going to need to use this first wave of apps for as much design and user experience information as they can get.
In addition to reviewing each app, I contacted the app creators to get additional insights about the app development process. So here are some of the highlights and challenges they reported.
100 Years Ago developer Jesse Vig used feedback from a previous app he developed to guide the direction for his winning voicebot. According to Jesse:
Prior to building 100 Years Ago, I built another action called Time Machine that reads headlines from the past and plays a brief time travel sound effect. Surprisingly, most of the positive feedback I got was about the sound effect. Based on this experience, I wanted to create a richer audio experience with 100 Years Ago.
Arun Rao, CEO of Starbutter, the company that developed Credit Card Helper, also has strategic advice for app developers:
On the design side, state your Action’s key objectives early and try to design a “Wow” experience around them. If you do too much or don’t have a clear objective, your Action won’t be interesting. The first part of “Wow” is to not do anything really dumb — which takes a lot of user testing to figure out.
I previously mentioned the challenges of designing information for a voice interface. Jesse Vig also addresses this, saying:
I was able to create a much richer experience when the action had access to a visual display, as in the case of Google Assistant on mobile devices. Reading is faster than listening, and obviously images cannot be conveyed through an audio interface.
Arun Rao has some good advice for approaching new apps:
For use cases, think about where voice or chat interactivity adds much more value than a current experience. Test this out with prototypes or videos before you build anything (BotSociety is a good prototyping tool to start with).
He also offers up a valuable technical recommendation for maximizing app performance:
On the technical side, go serverless and use Google Cloud Functions or Amazon Lambda. These are efficient and more scalable and error-proof for webhooks than having a real or virtual server.
Along a similar vein, Nick Laing, developer of My Adventure Book, suggested new developers use the existing tools.
My advice to any beginners is to start with DialogFlow, there is a lot you can do with that console alone. Once you get familiar with the platform you can write your own code to expand the functionality.
As the voice assistant industry enters it’s 4th year as a consumer gadget, there’s enormous potential on the horizon. These early examples are the tip of a large and growing iceberg. (And Earth needs more ice, right?) If one thing is certain, it’s that the devices, the apps, and the user base, are all going to evolve considerably over the next few years. It should be an exciting race.
Thanks to Arun Rao, Jesse Vig and Nick Laing, not only for their work but their generosity in providing guidance for other app developers.
I’ll be reviewing more voicebots in the coming weeks, so if you’d like to stay up on the latest creations, please follow me."
52,Voicebot.ai Interview with VoiceLabs,voicebot,https://medium.com/@marchick/voicebot-ai-interview-with-voicelabs-5906d2ea71a6,"What did you see in the market that motivated you to start VoiceLabs?
Adam Marchick: The first thing I want to do is give a lot of credit to my cofounder Alex Linares, the Chief Product Officer at VoiceLabs. I was skiing and on sabbatical because I hadn’t had a vacation in five years, and was thinking about doing something new. Alex was an Entrepreneur-in-Residence at The Chernin Group and gave me a call. “Have you checked out this Echo thing.” Alex is an amazing product person. He built the number one Facebook app. He built one of the first mobile apps to reach one million downloads from the App Store. Alex told me, “This Echo thing is amazing. Once I started using it, I’m never going back.” I’m an enterprise software nerd so I said, “Where is the AdMob, Flurry or Kahuna here.” They didn’t exist.
We saw that developers had no help with analytics or monetization. We started talking to people about their critical needs. I was fortunate enough to be on the Facebook growth team and had immersed in that emerging ecosystem. So, I asked similar questions to Alexa developers: “Do you know how users are experiencing your apps?” They said, “No. I tried trying to use mobile analytics but it didn’t work for voice.” When we dug in, we realized there were differences between voice, mobile and web that required specialized analytics.
What problem do you solve?
Marchick: Analytics for voice applications. A lot of this comes from my background in actionable analytics. I started asking questions, “What does my voice usage look like? Are people opening my Amazon skill and leaving delighted or frustrated? Are they opening the skills repeatedly and with what usage patterns? Are they getting the right answers? How are they navigating?” That is where the creation of voice pathing came from. VoiceLabs is the next generation of funnel analytics made for voice.

VoiceLabs’ Voice Pathing showing a successful voice session in a developer’s Voice app. “Successful sessions are the key to a delightful consumer experience,” said VoiceLabs CEO Adam Marchick.
Are you building Google Analytics for the voice web? What else do you have on the horizon?
Marchick: I like to think of this as more Mixpanel because we are going to be cross-platform and I really respect them, but Google Analytics is also a good analogy. It’s not just, “here are your metrics.” It is also, “What was your goal conversion rate and monetization?” It is voice-specific, which is unique. In mobile and web, the click-throughs matter a lot. In voice, it is lot about what is being said, the Intent and how Voice bots respond to spoken words.
On the web, you only care that they entered the email address. Great. Here [in voice] it matters a lot what they said and how Alexa responded. Looking at logs and pulling out the speech-to-text. It’s more than just looking at interaction metrics. We are also evaluating the responses provided by Alexa. That is where you really see the consumer experience play out. That is where the analytics are critical and the insights are really actionable.
You mention in a blog post that our devices will largely determine which assistants we use because their will be too much hassle to switch. Given that statement, which platforms are you betting on will have the biggest user base?
Marchick: Right now, it’s impressive that Alexa is on the Echo, FireTVs and all of Amazon’s Fire Tablets. By Q1, should be about 40 million devices. It’s no secret that Apple has 1 billion iPhones sold, so Siri will be big. Google Assistant will be big part of this story because of Android. Samsung, with the acquisition of Viv, is now important. Microsoft is smart, so something will happen with Cortana, and they have 20 million Xboxes so they have a built-in user base.
There are Access Points and Voice Interfaces. There is no question that Apple and Android have the largest number of Access Points, many with active voice usage (but not a majority). What is awesome about the Echo is that everyone with one actively uses voice.
How do you expect the introduction of Google Home to impact the consumer market?
Marchick: People are really excited about it. I think consumers have a lot of brand affinity for Google. We still don’t know exactly what it will and won’t do. What Amazon got right is streaming music and home automation. It will be exciting to see what Google gets right.
I am an advocate for the third party developer. Being part of building the Facebook and mobile ecosystems, I recognize that you have to make it valuable for developers to spend time in your platform. That speaks to an open ecosystem. By contrast, Google AdWords is not an open ecosystem but it is enormous. Google is the market leader in creating an open ecosystem, Android, and a closed ecosystem, AdWords. In this market, you need as many great people innovating as possible. So, I am assuming it will be open and developer-friendly whether they have a skill, app or some other model. It could be different than a traditional app model, but Google has told us what that different way is yet.
Many people view Alexa as the first real voice assistant at any meaningful scale, even though Siri would like to make the claim as well and Google’s variously named voice assistants may have a stronger case to make. How do you distinguish between what Siri and Google Now have done previously and Alexa, if at all?
Marchick: It goes back to this idea of an open ecosystem. If you look at voice searches, there is a distinction between “Call Mom” and “I want to order a pizza.” The idea that voice search leads to third parties getting involved with complex interactions is much more sophisticated than making a call that Apple can control completely on its own platform. The Amazon Echo worked with other people to make stuff happen. That is different and leads to a whole new level of innovation. I can get a great recipe from the Food Network while I’m in the kitchen. That is awesome. Siri or Google would return search results and you start clicking and are back to text based stuff, and that doesn’t work when my hands are messy with tomato sauce, because unfortunately I am not a culinary whiz.
Your presentation tonight to the NYC Alexa Meetup group suggests that sessions per day are the key metric that Alexa skill developers should focus on. Why sessions per day specifically, and not duration of session, number of interactions per session or number of users?
Marchick: It’s a metric of engagement. I wanted the talk to focus on doubling your engagement. We can also talk about the other metrics and that would be a different presentation. I’m a growth marketer and I learned from the best in the business by being lucky enough to work at Facebook — there other metrics that are just as important. I am just focusing on sessions per day for that talk.
Monetization or lack thereof is a topic that comes up in some of the Alexa developer forums. You mention in-skill advertising in your presentation. How do you see monetization playing out on Alexa and other platforms? Will it be advertising or another play, and why?
Marchick: There are still some structural issues to making advertising valuable. History repeats itself. Getting the ecosystem to scale is critical. Once you have that, you have to determine the best way to monetize. Scale makes the world go around. That is what we are helping people with. Until there is scale, it won’t be clear what is best. We actually have built a voice ad network, and it’s ready whenever the market is ready.
Who should be building for the voice web / voice ecosystem?
Marchick: Let’s look at it another way. Who shouldn’t be building for it — someone who just wants to have a placeholder in the voice ecosystem. They won’t be satisfied with what happens because distribution and acquisition isn’t that functional yet. You have to be committed to building something that is interesting and useful for consumers. Otherwise, you will have no installs or repeat users. In mobile, you could build a mediocre app and buy a million installs. You can’t do that here.
What is your favorite voice-enabled skill, application or utility?
Marchick: I use Amazon Music daily. There is no question, the first two billion-dollar voice applications are streaming music and home automation. That said, we are starting to see some innovation. I used the Yahoo Fantasy football skill this weekend and it was pretty fun."
53,"AI & NLP Workshop: Learn how to make an AI powered, NLP based Voice Bot",voicebot,https://becominghuman.ai/ai-nlp-workshop-learn-how-to-make-an-ai-powered-nlp-based-voice-bot-23b1d5575f0b,"Build a Marketing/Customer Service Voice Bot in our All Day Workshop
AI is no longer the future… it is now the present. AI has quickly gone from the innovation labs to being fully implemented from one department to the next. Take a look at the recent successes:
Chase: JPMorgan’s COIN, has saved over 360,000 hours of manpower! What does it do? COIN reads contracts and makes sure there are no errors.
HiCharlie: This bot keep track of your finances so you don’t have to. On average Charlie saves users $80 per week!
Sweedbank: Their chatbot, Nina, handles 40,000 conversations a month and resolves 81% of the issues.
Trim: Trim is Financial Assistant bot that can help you reduce expenses and even negotiate bills on your behalf. Trim has a 94% retention rate!
The AI revolution needs people that understand the technology and can take it to the next level.
Currently there is a $150 Discount for this Workshop but there are only a few tickets left. RSVP to claim the discount.

Learn how to make an AI powered, NLP based Voice Bot
In this workshop you will learn from industry experts on AI/ML/NLP and will be working on building a Customer Service or Marketing Chatbot which you can launch on Messenger, your website or on Google Voice or Alexa.

The Schedule

This is a full day workshop, that starts at 9am and ends at 5pm. Breakfast, coffee, and lunch will be provided ☕️

Let’s meet the instructors

By the end of this course you will have designed, built and launched an intelligent Customer Service Chatbot using SmartLoop.Ai technologies along with RASA’s open source NLP which is built on Tensorflow.
Ideal for
Anyone Interested in VOICE, AI, or Bots
Product Managers
Designers
Developers
Marketers,
Customer Service Department
Human Resources
Reasons to attend:
Learn the basics of Machine Learning and AI
Learn to collect data, label and classify
Easy build NLP, Deep Learning applications and get started in no time"
54,Converse.AI and Actions on Google enable every business to build a voice bot without writing code.,voicebot,https://blog.converse.ai/converse-ai-and-actions-on-google-enable-every-business-to-build-a-voice-bot-without-writing-code-b703e1f04dc6,"Converse.AI, in partnership with Actions on Google, have launched the easiest and simplest way to build a voice bot, for any business, without the need to write any code.
Converse.AI enables companies to easily build bots, capable of answering questions, holding conversations, managing workflow and integrating into external systems, using it’s unique Chatflow capabilities.
Actions on Google enables anyone to build for the Google Assistant. Your integrations can help you engage users through Google Home today, and in the future, through Pixel, Google Allo, and many other experiences where the Google Assistant will be available.
It is the first voice platform to be integrated with Converse.AI and the combination of both platforms enables any business to have their own voice bot, without having to use scarce developer resources.
The first Google Action launched on the Converse.AI platform, Bay Transport, enables the user to track their preferred route on the BART transport system, set their home stations and easily discover when the next available train will be arriving.

The interest in voice automated services is set to grow significantly in the coming months and the use cases are endless. The ability to build and rapidly iterate a voice activated bot, will soon be crucial for businesses wanting to increase engagement with their customers.
Image being able to check your bank balance find out the delivery schedule of your latest online purchase, finding out film listings at your nearest cinema and booking tickets, and much more.
This first Google Action from Converse.AI is just the first step in proving what is already possible, we are really excited to see what you build!
Get started by signing up or checking out our documentation!"
