doc_id,title,term,url,text
24,Examples of Intelligent Personal Assistant Built on Top of Cirkus,intelligent personal assistant,https://medium.com/@vlad.k/single-user-interface-in-examples-df1791488e9d,"In this article I will identify some real examples of intelligent personal assistant built on top of Cirkus when used for dealing with any particular user’s situations. The screens shown below are not complete nor perfect; however, the main point is to illuminate core principles of a personal assistant. Cirkus is an open environment, thus everybody is capable to build a perfect assistant in the future.
The main purpose of a personal assistant is to enable a real person (user) to be in permanent contact with his online identity, representing his online presence. Everyone’s and everything’s activities are fragmented into very detailed situations in Cirkus environment. Therefore, the main thing which is always shown in a personal assistant is a user’s current situation and its related service. Current user’s situation can be recognized or established by various ways. For example, the user can state or say his current need (or there can be used a mind reading approach in the future also). Another option is automatic detection of a user’s situation depending on his current circumstances. Also, the user’s situation changes as he performs actions offered by services.
Let’s have a look now at how a personal assistant can be used, for example, to order a taxi. We let a user write his requirement for a taxi simply into the text input here.

Personal assistant passes this query on the server where data of user’s online identity is stored. Next, it finds out from the knowledge, that in case of a “need a taxi” query, the user is probably in a “taxi customer” role and in a situation, when he wants to order a taxi. Additional information that we get from the knowledge is when situations of others match to a user’s current situation. In the case of a taxi ordering, matching situations are those representing available taxi drivers. Another piece of information obtainable from the knowledge is that we can order a taxi ride if we have a taxi driver. All of this information we got from the knowledge is then mashed-up together with users’ data and returned back to a personal assistant in the form of a situational service.

All the situations appear in personal assistant in its textual form. Possible actions appear in the form of controls like buttons or menu items. Actions, when performed, change current user’s situation and possibly the situation of other users. The knowledge configures what types of different situations should be simultaneously created for different roles. Thus, when the user press the “Order” button from our example, he reaches a new situation: “I ordered new taxi ride”.

Simultaneously, the taxi driver gets into the new “I got new taxi ride” situation.

Similar to the previous example, if I want to write a blog post I could just send a query “write a blog post”.

Given by the knowledge, it means I’m in the “blogger” role and the situation when I want to write a blog post. Among the other information, there is a blog post entity with its properties configured in the knowledge for this type of situation. Thus, personal assistant shows input form to fill in all the necessary blog post content.

In a “I have a blog” situation, the user can see his blog posts and a button which leads to the creation of new blog post. More precisely, it leads to the same situation (“I want to write a blog post”) which we got into with the previous “write a blog post” textual input.

Personal assistant can also suggest future situations and actions automatically dependent on the current user’s state, his current role and situation, location, time, etc.

Personal assistant also enables us to see other online identities and it’s relations in the same way as we browse common websites. For example, there is a configured a Cirkus Environment Reader role in the knowledge and its possible situations and actions towards Cirkus Environment and related online identities. Textual information represent properties of these identities, while navigation items represent possible Cirkus Environment Reader’s actions.

Application of the knowledge to our data and its interpretation in a personal assistant brings us plenty of new possibilities in terms of seamless interactions amongst users. We will cover another interesting examples in detail in some of next articles."
25,Contribution of an intelligent personal assistant in Our Daily Life,intelligent personal assistant,https://medium.com/@namejacob16/contribution-of-an-intelligent-personal-assistant-in-our-daily-life-4b45b36836e0,"An intelligent personal assistant is also known as Automated Personal Assistance. It is a program that can perform tasks as though it were a human. The task to which IPA will respond is based on an input and location recognition. IPA is also capable of fetching the information from a variety of online sources like weather updates, stock prices, latest news etc. AI Personal Assistant technology is accredited by the concoction of API, Smart Phones and the escalation of mobile apps. However, it designed in such a way that it can perform any task given by an individual but the limitation of this system is that it can perform one task at a time by hearing the voice instructions of the user. One of the key features of an AI Personal Assistant is that it organizes information according to an individual’s needs, including the management of calendar events, emails, to-do-list, files, music etc.
Most people are unaware that they are using an intelligent personal assistant in their everyday life in the form of applications like LG G3’s Voice Mate, Samsung’s S Voice, Google’s Google Home, Amazon Alexa and many others. These software solutions are the best example of IPA and help us to manage a proper schedule of tasks in our busy life. We all are aware of Apple’s Siri, which is also an AI Personal Assistant that helps us in doing things like sending text messages, checking the weather, and reminders setting, playing music list as well as it also answer the question about geographical locations through GPS system. For this, you have to only ask Siri for the things you want to do and rest she we will arrange things according to your comfort and need.
AI Personal Assistant not only reminds you of what to do at a certain time but it will also remind you what to do at certain place.. And when you want to send text messages, you don’t need to lay your fingers on the Smartphone, you only need to tell the message and sender name, and then automatically AI Personal Assistant sent it to your recipient. All these small-small things that we use in our daily life in our mobile phones become hi-tech and helps us to save our time in many other ways. With the help of the evolution of IPA, now there is no need to hire a personal assistant for maintaining and scheduling personal and professional activities because it can do anything that one personal assistance can do for you, even it is smarter, faster and secure than human being and resolve any problems within a seconds.
In India, there are many software companies thatare working on AI Personal Assistant designing and provide Free CRM Software that helps in engulfing broad set of applications to manage the data of customer for business purpose. It also very helpful in maintaining the proper interaction between company and customer, access business information, marketing, automate sales, marketing and customer support."
26,Intelligent Personal Assistant Market Booming Across the World,intelligent personal assistant,https://medium.com/datadriveninvestor/intelligent-personal-assistant-market-booming-across-the-world-352fa7a99f23,"Report Consultant’s analysts forecast the global intelligent personal assistant market is expected to grow at a CAGR of +36.7%.
DDI Editor's Pick: 5 Machine Learning Books That Turn You from Novice to Expert - Data Driven…
The booming growth in the Machine Learning industry has brought renewed interest in people about Artificial…
go.datadriveninvestor.com
An intelligent personal assistant is a system with artificial intelligence (AI) which imitates human interaction in order to carry out particular tasks. This system is being increasingly used due to machine learning along with other advancements made in AI technologies. Intelligent personal assistants have a large capacity to learn, reason and understand which are the three essential components required to emulate the problem-solving abilities of a customer service agent.
Request for Sample Report @
https://www.reportconsultant.com/request_sample.php?id=5496
Top Key Players of Intelligent Personal Assistant Market:
· Apple, Inc.
· Google LLC
· IBM Corporation
· Oracle Corporation
· Microsoft Corporation
Type Outlook of Intelligent Personal Assistant Industry: Speech Recognition, Test-to-Speech Recognition
Service Outlook of Intelligent Personal Assistant Industry: Customer Service, Marketing Assistant
Application Outlook of Intelligent Personal Assistant Industry: BFSI, Automotive, IT & Telecom, Retail, Healthcare, Education, Others
End-Use Outlook of Intelligent Personal Assistant Industry: Small and Medium Enterprise, Large Enterprise, and Individual User
Ask for Discount / Customization on Report @
https://www.reportconsultant.com/ask_for_discount.php?id=5496
According to the research report, the global intelligent personal Assistant market has gained significant momentum over the recent past. The accumulative recognition, the increasing demand and the growing necessity for this market’s products are revealed in the study. Along with this, the features functioning their acceptance among consumers are also mentioned in this report study. This market report offers a comprehensive analysis of the overall scenario in the global market."
27,The intelligent Personal Assistant,intelligent personal assistant,https://medium.com/@mrtomconnelly/in-1997-my-father-purchased-some-voice-recognition-software-called-naturallyspeaking-by-dragon-5f454a3b380e,"In 1997 my father purchased some voice recognition software called NaturallySpeaking by Dragon Systems. It was my first introduction to voice recognition technology and although it wasn’t 100% accurate (it really was quite useless), I was amazed that it was possible.
These days all you have to do is say “OK Google” or “Hey Siri” and your phone is ready to take your command. Setting reminders, sending text messages, and making calls is only a taste of what can be actioned via voice commands.
Voice recognition technology has come a long way.
I’m an avid user of Google’s intelligent personal assistant (IPA) service Google Now aka “OK Google”. The thing is, I don’t like using it in public. When I do, I try to keep it discreet until I give up and switch back to the ol’ fingers and thumbs. Friends and family I’ve spoken to say they feel the same way.
I feel like this technology is going through its teething stage where we’re not sure if it’s cool yet. This is such a great tool but it must be embraced in order for it to improve and be used more across more applications. What can be done to help this technology be adopted by the mainstream and socially accepted?
Allow custom wake up commands
I don’t want to walk down the street saying “Ok Google”. Why can’t I create my own activation phrase? I’d be much more comfortable using my IPA in public if I was able to say something like “Are you ready?”. As far as I’m aware, S Voice for Samsung is the only IPA that allows custom wake up commands.
Make it so I can “call” my intelligent personal assistant
I want push a button, put my phone to my ear and hear a voice say “How can I help?”. Imagine it, you could be rushing to work talking to your IPA on the phone, sending texts, writing emails, learning your agenda for the day and more. Voice recognition works best when your mouth is directly next to the receiver anyway. Why not hold it to your head like you’re on a call?
Flip it on its head – Dictaphone style
I often turn my phone upside down and speak into it like a dictaphone. This allows me speak directly into the receiver and glance down to my screen for more information. The problem is my phone doesn’t automatically invert the screen when the phone is the wrong way around. This idea impacts the phone’s operating system and the possibly the phones design rather than functionality of the IPA software.
“Is there anything else I can help you with today?”
When I make a voice command and it’s answered, the IPA should continually ask me “Can I help you with anything else?”. This would eliminates the need to repeat the voice recognition command and facilitate multiple commands.
This powerful technology won’t be applied to more apps and tools until it becomes adopted by the mainstream. For this to happen, I believe the way users engage with IPA software must be matched with existing technologies that they are familiar with and feel comfortable using."
28,Apple Inc. To Replace Intelligent Personal Assistant Siri With Viv,intelligent personal assistant,https://medium.com/@praneethrover/apple-inc-to-replace-intelligent-personal-assistant-siri-with-viv-6ee3772b3149,"Apple Siri is gonna expire soon. Dag Kittlaus and Adam Cheyer, Inventors of Siri, have invented a new Artificial Intelligence Technology called ‘Viv‘. It is a powerful AI invented by Siri’s creators from APPLE which can be able to learn from the world to improve upon its capabilities.
Apple is the world’s largest IT company by revenue and 2nd largest mobile manufacturing company. This AI bot is more advanced than Siri and is super smart than any human being or any virtual assistant which can be able to carry out any complex tasks by mimicking the knowledge data-base of a human assistant.
Actually, “Viv” was named after the Latin root meaning of ‘Life’. It is more advanced than Siri, Google, Cortana or Alexa. According to the inventors the Viv is supposed to be more flexible in its own way and providing the need or feel of a human."
29,BMW Introduces Intelligent Personal Assistant for its Cars,intelligent personal assistant,https://medium.com/@techstoryin/bmw-introduces-intelligent-personal-assistant-for-its-cars-9e0320af4add,"Gone are the days when cars were only used to go from one place to other. Today, they are a mark of luxury, comfort, and convenience. And the manufacturers are also not keeping it loose in providing the best and effortless experience for their customers. Taking a step further in this direction, BMW has introduced an Intelligent Personal assistant (IPA) for its cars to keep the driver free from doing anything.
The IPA will hear you when you say, “Hey BMW,” and the name can be changed to anything you want it to be called. Once it hears you, you can ask it to manage or change any functions of the car including the navigation, climate control lighting, infotainment system, headlight settings, and almost every other thing that is electrically controlled.
Also Read: BMW Thinks Fully Driverless Cars are Impractical
The IPA will join the driver as a stranger with basic settings at first, then it will keep learning about the driver’s preferences and routines. “BMW’s Personal Assistant gets to know you over time with each of your voice commands and by using your car,” BMW’s senior vice president Digital Products and Services, Dieter May, said. “It gets better and better every single day.”

The Personal assistance will also be able to react to natural human commands, so you could say, “Hey BMW, I’m cold,” and it will adjust the climate control accordingly. BMW says the IPA is the ideal co-driver, as you could ask it to search for nearby gas stations, restaurants, available parking spots, etc.
Also read: 2019 BMW Z4 Breaks Cover at Pebble Beach with a Soft Top–
BMW has recently partnered with Amazon for the voice assistance technology. While the IPA will make your driving experience better, Alexa will look after your shopping, your smart devices at home and office, and all other tasks. By integrating these two, you can have a seamless movement during your day without having to carry or remember any information.
BMW has had a long partnership with Microsoft with its cloud platform Azure. The latest BMW Intelligent Assistance is also built on top of Azure and conversational technologies. BMW has also integrated office 365 and Skype with its IPA, so, the driver can manage the work and attend skype conferences along the way. It is expected that Microsoft’s voice assistant Cortana will also be joining the BMW cars soon.
The BMW Intelligent Personal assistance will be rolled out from March 2019 as standard in the new X5, Z4, and the 8-Series models, an over-the-air software upgrade. The IPA will also be available in the 3-series but as an option and the service will be offered for three years only."
